{
  "$schema": "../schemas/calibration.schema.json",
  "id": "jukki-usa-vs-bc-japan-mio-admiral",
  "gameVersion": "1.19.3",
  "mods": [
    "Their Finest Bruh (dev checkout)"
  ],
  "notes": "USA vs Japan with doctrines (Fleet in Being, all tracks, Decisive Battle), MIOs and admirals (Halsey, Yamaguchi) on both sides; the game made Japan (ROM) the attacker. All 10 seeds roll-logged; every shot replays exactly.",
  "scenario": "jukki_usa_vs_bc_japan_mio_admiral.json",
  "attackerCountry": "ROM",
  "conditions": {
    "startHourOfDay": 13,
    "weather": "clear",
    "weatherEnabled": false,
    "terrain": "ocean"
  },
  "summary": {
    "runs": 10,
    "durationHours": {
      "mean": 146,
      "sd": 67.83,
      "min": 105,
      "max": 334
    },
    "outcomes": {
      "AttackerVictory": 10
    },
    "sides": [
      {
        "side": "attacker",
        "hpLeft": {
          "mean": 7952.19,
          "sd": 2025.91,
          "min": 2692.1,
          "max": 9562.5
        },
        "sunk": {
          "mean": 16.9,
          "sd": 10.15,
          "min": 6,
          "max": 43
        }
      },
      {
        "side": "defender",
        "hpLeft": {
          "mean": 357.58,
          "sd": 173.36,
          "min": 111.7,
          "max": 644.3
        },
        "sunk": {
          "mean": 41,
          "sd": 4.11,
          "min": 35,
          "max": 47
        }
      }
    ],
    "designs": [
      {
        "side": "attacker",
        "design": "39_battlecruiser_pure_la",
        "count": 12,
        "sunk": {
          "mean": 0.3,
          "sd": 0.48,
          "min": 0,
          "max": 1
        },
        "retreated": {
          "mean": 0.6,
          "sd": 1.26,
          "min": 0,
          "max": 4
        },
        "remaining": {
          "mean": 11.1,
          "sd": 1.6,
          "min": 7,
          "max": 12
        },
        "hpLeft": {
          "mean": 3964.38,
          "sd": 710.52,
          "min": 2222.0,
          "max": 4705.7
        }
      },
      {
        "side": "attacker",
        "design": "dd_3_la",
        "count": 54,
        "sunk": {
          "mean": 16.4,
          "sd": 9.28,
          "min": 6,
          "max": 40
        },
        "retreated": {
          "mean": 11.2,
          "sd": 2.7,
          "min": 7,
          "max": 15
        },
        "remaining": {
          "mean": 26.4,
          "sd": 10.66,
          "min": 0,
          "max": 35
        },
        "hpLeft": {
          "mean": 1255.2,
          "sd": 436.32,
          "min": 204.7,
          "max": 1725.2
        }
      },
      {
        "side": "attacker",
        "design": "shbb_4battery_2aa",
        "count": 6,
        "sunk": {
          "mean": 0.2,
          "sd": 0.63,
          "min": 0,
          "max": 2
        },
        "retreated": {
          "mean": 0.6,
          "sd": 1.35,
          "min": 0,
          "max": 4
        },
        "remaining": {
          "mean": 5.2,
          "sd": 1.93,
          "min": 0,
          "max": 6
        },
        "hpLeft": {
          "mean": 2732.61,
          "sd": 965.58,
          "min": 265.4,
          "max": 3548.7
        }
      },
      {
        "side": "defender",
        "design": "36lc_a3_la3",
        "count": 27,
        "sunk": {
          "mean": 19.4,
          "sd": 2.5,
          "min": 14,
          "max": 22
        },
        "retreated": {
          "mean": 7.6,
          "sd": 2.5,
          "min": 5,
          "max": 13
        },
        "remaining": {
          "mean": 0,
          "sd": 0.0,
          "min": 0,
          "max": 0
        },
        "hpLeft": {
          "mean": 167.31,
          "sd": 67.56,
          "min": 70.2,
          "max": 259.5
        }
      },
      {
        "side": "defender",
        "design": "39_battleship_pure_la",
        "count": 10,
        "sunk": {
          "mean": 8.7,
          "sd": 1.34,
          "min": 6,
          "max": 10
        },
        "retreated": {
          "mean": 1.3,
          "sd": 1.34,
          "min": 0,
          "max": 4
        },
        "remaining": {
          "mean": 0,
          "sd": 0.0,
          "min": 0,
          "max": 0
        },
        "hpLeft": {
          "mean": 66.95,
          "sd": 77.87,
          "min": 0.0,
          "max": 253.8
        }
      },
      {
        "side": "defender",
        "design": "39lc_la",
        "count": 10,
        "sunk": {
          "mean": 7.4,
          "sd": 1.43,
          "min": 6,
          "max": 10
        },
        "retreated": {
          "mean": 2.6,
          "sd": 1.43,
          "min": 0,
          "max": 4
        },
        "remaining": {
          "mean": 0,
          "sd": 0.0,
          "min": 0,
          "max": 0
        },
        "hpLeft": {
          "mean": 76.87,
          "sd": 46.5,
          "min": 0.0,
          "max": 134.3
        }
      },
      {
        "side": "defender",
        "design": "shbb_4battery_2aa",
        "count": 6,
        "sunk": {
          "mean": 5.5,
          "sd": 0.71,
          "min": 4,
          "max": 6
        },
        "retreated": {
          "mean": 0.5,
          "sd": 0.71,
          "min": 0,
          "max": 2
        },
        "remaining": {
          "mean": 0,
          "sd": 0.0,
          "min": 0,
          "max": 0
        },
        "hpLeft": {
          "mean": 46.45,
          "sd": 79.06,
          "min": 0.0,
          "max": 246.5
        }
      }
    ]
  },
  "simulatorReference": {
    "commit": "39fa4c8",
    "seeds": "1..200",
    "runs": 200,
    "durationHours": {
      "mean": 140.38,
      "sd": 20.07,
      "min": 95,
      "max": 230
    },
    "outcomes": {
      "AttackerVictory": 200
    },
    "sides": [
      {
        "side": "attacker",
        "hpLeft": {
          "mean": 7508.89,
          "sd": 1123.86,
          "min": 3917.6,
          "max": 10336.7
        },
        "sunk": {
          "mean": 17.94,
          "sd": 5.81,
          "min": 2,
          "max": 42
        }
      },
      {
        "side": "defender",
        "hpLeft": {
          "mean": 386.0,
          "sd": 148.52,
          "min": 42.6,
          "max": 954.3
        },
        "sunk": {
          "mean": 41.03,
          "sd": 3.45,
          "min": 30,
          "max": 51
        }
      }
    ],
    "designs": [
      {
        "side": "attacker",
        "design": "39_battlecruiser_pure_la",
        "count": 12,
        "sunk": {
          "mean": 0.37,
          "sd": 0.67,
          "min": 0,
          "max": 5
        },
        "retreated": {
          "mean": 0.76,
          "sd": 0.94,
          "min": 0,
          "max": 4
        },
        "remaining": {
          "mean": 10.87,
          "sd": 1.14,
          "min": 7,
          "max": 12
        },
        "hpLeft": {
          "mean": 3783.64,
          "sd": 579.71,
          "min": 2310.4,
          "max": 5352.4
        }
      },
      {
        "side": "attacker",
        "design": "dd_3_la",
        "count": 54,
        "sunk": {
          "mean": 17.36,
          "sd": 5.48,
          "min": 2,
          "max": 41
        },
        "retreated": {
          "mean": 12.27,
          "sd": 3.63,
          "min": 4,
          "max": 24
        },
        "remaining": {
          "mean": 24.38,
          "sd": 6.64,
          "min": 0,
          "max": 43
        },
        "hpLeft": {
          "mean": 1180.41,
          "sd": 257.15,
          "min": 223.7,
          "max": 1915.8
        }
      },
      {
        "side": "attacker",
        "design": "shbb_4battery_2aa",
        "count": 6,
        "sunk": {
          "mean": 0.21,
          "sd": 0.48,
          "min": 0,
          "max": 2
        },
        "retreated": {
          "mean": 0.69,
          "sd": 0.83,
          "min": 0,
          "max": 4
        },
        "remaining": {
          "mean": 5.09,
          "sd": 0.98,
          "min": 1,
          "max": 6
        },
        "hpLeft": {
          "mean": 2544.83,
          "sd": 616.02,
          "min": 762.3,
          "max": 3922.8
        }
      },
      {
        "side": "defender",
        "design": "36lc_a3_la3",
        "count": 27,
        "sunk": {
          "mean": 20.37,
          "sd": 2.4,
          "min": 13,
          "max": 26
        },
        "retreated": {
          "mean": 6.63,
          "sd": 2.4,
          "min": 1,
          "max": 14
        },
        "remaining": {
          "mean": 0,
          "sd": 0.0,
          "min": 0,
          "max": 0
        },
        "hpLeft": {
          "mean": 147.59,
          "sd": 66.99,
          "min": 6.0,
          "max": 368.0
        }
      },
      {
        "side": "defender",
        "design": "39_battleship_pure_la",
        "count": 10,
        "sunk": {
          "mean": 8.19,
          "sd": 1.37,
          "min": 4,
          "max": 10
        },
        "retreated": {
          "mean": 1.81,
          "sd": 1.37,
          "min": 0,
          "max": 6
        },
        "remaining": {
          "mean": 0,
          "sd": 0.0,
          "min": 0,
          "max": 0
        },
        "hpLeft": {
          "mean": 99.15,
          "sd": 86.78,
          "min": 0.0,
          "max": 492.5
        }
      },
      {
        "side": "defender",
        "design": "39lc_la",
        "count": 10,
        "sunk": {
          "mean": 7.13,
          "sd": 1.48,
          "min": 2,
          "max": 10
        },
        "retreated": {
          "mean": 2.87,
          "sd": 1.48,
          "min": 0,
          "max": 8
        },
        "remaining": {
          "mean": 0,
          "sd": 0.0,
          "min": 0,
          "max": 0
        },
        "hpLeft": {
          "mean": 87.59,
          "sd": 52.48,
          "min": 0.0,
          "max": 271.2
        }
      },
      {
        "side": "defender",
        "design": "shbb_4battery_2aa",
        "count": 6,
        "sunk": {
          "mean": 5.34,
          "sd": 0.77,